article_id	title	main_topic	author	related_topics
672	Architecture with 800 of My Closest Friends: The Evolution of Comcast’s Architecture Guild	Architecture & Design	Jon Moore Daniel Bryant	Development|Architecture & Design|Culture & Methods|Architecture Analysis|Teamwork|Collaboration|Architecture|Agile|Business Technology Strategy
673	Agile Anti-Patterns: A Systems Thinking Approach	Culture & Methods	David Johnston Ben Linders	Culture & Methods|Agile Conferences|Antipatterns|Systems Thinking|Agile in the Enterprise|Architecture|Patterns|Training / Certification|Agile|Adopting Agile|Agile Certification
674	Real-Time Data Processing Using Redis Streams and Apache Spark Structured Streaming	AI, ML & Data Engineering	Roshan Kumar Srini Penchikala	Development|Architecture & Design|AI, ML & Data Engineering|NoSQL|Redis|Database|Data Analysis|Big Data|Infrastructure|Spark Streaming|Streaming|Apache Spark|Key-Value Store|Real Time|Data Analytics
675	Test-Driven Development: Really, It’s a Design Technique	Development	Mohamed Taman Daniel Bryant	Development|Integration Testing|Testing|Integration Test|Unit Testing|Java|Test-driven developmant
676	People Re-Engineering How To’s: The Magic of Teaming	Culture & Methods	Medhat Sabry Shane Hastie	Culture & Methods|Leadership|Diversity in Teams|Teamwork|Distributed Team|Agile|Group Communication
677	The Potential for Using a Service Mesh for Event-Driven Messaging	DevOps	Kasun Indrasiri Daniel Bryant	Development|Architecture & Design|DevOps|Envoy|Service Mesh|Event Driven Architecture|Architecture|Microservices
678	Open Source Robotics: Getting Started with Gazebo and ROS 2	AI, ML & Data Engineering	Louise Poubel Roland Meertens	Development|AI, ML & Data Engineering|Robotics|Sensors|Artificial Intelligence|Machine Learning|Simulation
679	A Simple Mindset Shift Turns Ineffective Teams into Productive Organizations	Culture & Methods	Michael de la Maza Shane Hastie	Culture & Methods|Coaching|Leadership|Servant Leadership|Coaching and Mentoring|Teamwork|Management|Collaboration|Agile
680	MOOtopia – Adapting the Spotify Model at MOO	Culture & Methods	Claire Donald Ben Linders	Culture & Methods|Agile Conferences|Agile in the Enterprise|Agile|Adopting Agile|Stories & Case Studies
681	Supporting Mental Health in the Tech Workplace	Culture & Methods	Nara Kasbergen Ben Linders	Development|Culture & Methods|Agile Conferences|Community|Workplace|Careers|Healthcare|Community News
682	API Gateways and Service Meshes: Opening the Door to Application Modernisation	DevOps	Daniel Bryant Charles Humble	Architecture & Design|DevOps|Envoy|Containers|Business/IT Alignment|Service Mesh|Enterprise Architecture|API Gateway|Architecture|Microservices|Digital Transformation|API|Cloud Computing|Kubernetes
683	Q&A on the Book Inviting Leadership	Culture & Methods	Ben Linders Dan Mezick Mark Sheffield	Culture & Methods|Leadership|Culture|Communication|Distributed Team|InfoQ|Agile|Book Review|Change
684	Q&A on the Docker on Windows – Second Edition	DevOps	Elton Stoneman Steef-Jan Wiggers	Development|Architecture & Design|Culture & Methods|DevOps|Containers|Windows|InfoQ|Operating Systems|Docker|Book Review|Cloud Computing|Cloud
685	The Data Science Mindset: Six Principles to Build Healthy Data-Driven Organizations	AI, ML & Data Engineering	Francesca Lazzeri Srini Penchikala	Development|Architecture & Design|AI, ML & Data Engineering|Data Analysis|Database|Data Science|Process Adoption|Artificial Intelligence|Agile|Machine Learning|Adoption|Metrics|Data Analytics
686	Q&A on the Book Can You Hear Me? - How to Connect with People in a Virtual World	Culture & Methods	Ben Linders Nick Morgan	Culture & Methods|Communication|Teamwork|Collaboration|Distributed Team|InfoQ|Agile|Meetings|Book Review
687	Using TypeScript with the MySQL Database	Development	Deepak Vohra Dylan Schiemann	Development|Architecture & Design|TypeScript|JavaScript|Database|Web Development|SQL|Node.js|TypeORM|MySQL|Dynamic Languages|Relational Databases
688	Test Automation: Prevention or Cure?	Culture & Methods	Jit Gosai Ben Linders	Culture & Methods|Software Craftsmanship|Testing|Agile in the Enterprise|Agile|Quality|Automation|Adopting Agile|Test Automation|Stories & Case Studies
689	Service Virtualization Meets Java: Hoverfly Tutorial	Development	Alex Soto Daniel Bryant	Development|Architecture & Design|Testing|Acceptance Testing|Java|Automated testing|Automation
690	The Many Flavors of “Low-Code”	Architecture & Design	Miguel Valdes Faura Thomas Betts	Architecture & Design|Code Generation|SOA|Enterprise Architecture|Architecture|Low Code|Workflow / BPM|Business Process Management
691	Robust Engineering: User Interfaces You Can Trust with State Machines	Development	Bruno Couriol Dylan Schiemann	Development|Architecture & Design|Software Development|Safety|JavaScript|Methodologies|Architecture|Web Development|Dynamic Languages|Best Practices|Functional Programming
692	To Multicluster, or Not to Multicluster: Inter-Cluster Communication Using a Service Mesh	DevOps	Andrew Jenkins Daniel Bryant	Development|Architecture & Design|DevOps|Containers|Service Mesh|Istio|Architecture|Software Defined Network (SDN)|Microservices|Software Defined Everything (SDE)|Cloud Computing|Kubernetes
693	Key Takeaway Points and Lessons Learned from QCon London 2019	Architecture & Design	Abel Avram Charles Humble	Development|Architecture & Design|Keynote|QCon London 2019|Architecture|QCon
694	Bots Are Coming! Approaches for Testing Conversational Interfaces	Culture & Methods	Lucian Adrian Ben Linders	Development|Culture & Methods|Agile Conferences|Testing|Artificial Intelligence|Architecture|Voice-enabled UI|Alexa|API|UI Testing|ChatBots
695	Kotlin Multiplatform for iOS Developers	Development	Ben Whitley Sergio De Simone	Development|Java|Mobile|Operating Systems|Kotlin|JVM Languages|iOS|Cross Platform
696	Q&A on the Book What’s Your Digital Business Model	Culture & Methods	Ben Linders Stephanie L. Woerner	Culture & Methods|Leadership|Business Agility|Business/IT Alignment|Enterprise Architecture|Business Value|Architecture|InfoQ|Agile|Digital Transformation|Book Review|Internet Of Things
697	Upgrading from Java 8 to Java 12	Development	Trisha Gee Charles Humble	Development|JDK 8|JDK 9|Java|JDK 10|JDK|JDK 12|JDK 11
698	Q&A on the Book Why Do So Many Incompetent Men Become Leaders?	Culture & Methods	Ben Linders Tomas Chamorro-Premuzic	Culture & Methods|Leadership|Servant Leadership|Diversity|Gamification|Artificial Intelligence|InfoQ|Game Development|Agile|Book Review
699	Linkerd v2: How Lessons from Production Adoption Resulted in a Rewrite of the Service Mesh	DevOps	William Morgan Daniel Bryant	Development|Architecture & Design|DevOps|Service Mesh|Architecture|Software Defined Network (SDN)|Microservices|Software Defined Everything (SDE)|Linkerd|Cloud Computing
700	How Expedia Is Getting Rid of Java Bean Transformers	Development	Fabio Borriello Ben Evans	Development|Architecture & Design|Java
701	Q&A on the Book OpenSpace Beta - A Handbook for Organizational Transformation in Just 90 Days	Culture & Methods	Niels Pflaeging Ben Linders Silke Hermann	InfoQ|Culture & Methods|Game Development|Agile|Self-organizing Team|Book Review|Mindset|Open Space Technology|Culture|Teamwork|Gamification|Scrum|Culture Change|Change
702	The Impact and Ethics of Conversational Artificial Intelligence	Development	Gillian Armstrong Daniel Bryant	Development|Architecture & Design|Culture & Methods|AI, ML & Data Engineering|Ethics|Artificial Intelligence|Alexa|Emerging Technologies
703	Scrum@Scale: An Interview with Agile Manifesto Co-Author and Scrum Co-Founder Jeff Sutherland	Culture & Methods	Shaaron A Alvares Jeff Sutherland	Development|Culture & Methods|Leadership|Antipatterns|Architecture|Scaling Agile|Patterns|Agile|Scrum
704	Sleeping Well at Night During a Live Cloud Migration in a VMware Environment	DevOps	Rich Petersen Richard Seroter	Architecture & Design|DevOps|Cloud Migration|VMWare|Database|Data Management|Cloud Computing|Cloud
705	Q&A on the Book Designing the Future	Culture & Methods	Ben Linders Jeffrey Liker James Morgan	Culture & Methods|Leadership|Lean Thinking|Product Development|InfoQ|Agile|Lean|Innovation|Book Review|Stories & Case Studies
706	Seven Steps for Improving Cloud Security with Business Integration	DevOps	Sam Bocetta Richard Seroter	Architecture & Design|DevOps|Deployment|Information Security|Security|Application Security|Public Cloud|Cloud Computing|Cloud Security|Cloud
707	Simplicity, Please - A Manifesto for Software Development	Culture & Methods	Paul Merlyn Shane Hastie	Development|Culture & Methods|Software Craftsmanship|Technical Excellence|Technical Debt|Agile|Complex Systems
708	Why Isn't Your Current Approach to Scaling Agile Working?	Culture & Methods	Cesario Ramos Kurt Bittner Shane Hastie	Culture & Methods|Scaling|Agile at Scale|Agile in the Enterprise|Agile
709	Transforming the Healthcare Industry through API Marketplaces	Architecture & Design	Sachini Samson Chanaka Fernando Nuwan Bandara Thomas Betts	Architecture & Design|Enterprise Information Integration|Architecture|Healthcare|Infrastructure|API
710	Q&A on the Book Evidence-Based Management	Culture & Methods	Denise Rousseau Ben Linders	Culture & Methods|Data Analysis|Database|Continuous Improvement|Management|InfoQ|Agile|Feedback|Science|Data|Book Review
711	Culture & Methods – the State of Practice in 2019	Culture & Methods	Susan McIntosh Craig Smith Ben Linders Rui Miguel Ferreira Shaaron A Alvares Shane Hastie Rafiq Gemmail Charles Humble Shane Hastie	Development|Culture & Methods|DevOps|Ethics|Trends|Business Agility|Sociocracy|InfoQ|Agile|Self-organizing Team|NoProjects|Holacracy|Diversity|Teamwork|InfoQ Trends Report|Scrum
712	Book Review: Alexa Skills Projects by Madhur Bhargava	DevOps	Madhur Bhargava Kent Weare	Development|Amazon Web Services|IaaS|Cognitive Computing|Amazon|InfoQ|Alexa|Book Review|Cloud Computing|Cloud
713	Q&A on the Book Unlocking Agility	Culture & Methods	Ben Linders Jorgen Hesselberg	Business Agility|Teamwork|Agile in the Enterprise|InfoQ|Culture & Methods|Scaling Agile|Agile|Innovation|Adopting Agile|Book Review|Mindset
714	A Great Engineer Needs the Liberal Arts	Culture & Methods	Thomas Betts Susan McIntosh	Development|Architecture & Design|Culture & Methods|Culture|Continuous Improvement|learning|Software Engineering Education|Agile|Software Engineering
715	Crafting a Resilient Culture: Or, How to Survive an Accidental Mid-Day Production Incident	DevOps	Ryn Daniels Daniel Bryant	Development|Culture & Methods|DevOps|Culture|Disaster Recovery|Teamwork|Team Collaboration|Collaboration|Psychological Safety|Distributed Team|Agile|Automation|Incident Response
716	Exploring HyperLedger: Experience in Being a Framework Early Adopter	Architecture & Design	Yegor Maslov Konstantin Erokhin Ben Evans	Development|Architecture & Design|Blockchain|Hyperledger|Architecture|Emerging Technologies
717	Monitoring and Managing Workflows across Collaborating Microservices	Architecture & Design	Bernd Rücker Daniel Bryant	Architecture & Design|DevOps|Performance|SOA|Enterprise Architecture|Architecture|Workflow / BPM|Microservices|Monitoring|Business Process Management|Distributed Tracing|application performance management
718	Q&A on the Book Reinventing Jobs	Culture & Methods	John Boudreau Ben Linders Ravin Jesuthasan	Culture & Methods|Leadership|reward|Job Market|SOA|Robotic Process Automation|Enterprise Architecture|Architecture|InfoQ|Agile|Automation|Business Process Management|Book Review
719	2019 Scrum Master Trends Report Published	Culture & Methods	Stefan Wolpers Dave West Ben Linders	Culture & Methods|Scrum Master|Agile in the Enterprise|Careers|Scrum.org|Survey|Agile|Scrum|Adopting Agile
720	DevOps and Cloud InfoQ Trends Report - February 2019	DevOps	Helen Beal Chris Swan Manuel Pais Daniel Bryant Steffen Opel Charles Humble	Development|DevOps|IT Service Management|Continuous Delivery|Automated Deployment|Enterprise Architecture|Agile Techniques|InfoQ|Agile|Microservices|Observability|Chaos Engineering|Performance|Containers|Business/IT Alignment|PaaS|Service Mesh|InfoQ Trends Report|Continuous Integration|Architecture|Digital Transformation|Monitoring|Resilience|Cloud Computing|Kubernetes|application performance management
721	Two Sides of a Coin: Blockchain, Ethics and Human Rights	Culture & Methods	Max Schmid Sebastian Porsdam Mann Ben Linders	Culture & Methods|Ethics|Blockchain|Social Networking|Architecture|Science|Emerging Technologies
722	Tap Compare Testing with Diferencia and Java Microservices	Development	Alex Soto Daniel Bryant	Development|DevOps|Integration Testing|Testing|Integration Test|Architecture|Java|Microservices
723	Author Q&A on the Book Business Analysis Agility	Culture & Methods	Shane Hastie James Robertson Suzanne Robertson Shane Hastie	Culture & Methods|Product Owner|Product Backlog|Agile in the Enterprise|InfoQ|Agile|Scrum|Business Analysis|Adopting Agile|Book Review
724	Continuous Delivery - It’s Not All about Tech!	Culture & Methods	Sylvia MacDonald Ben Linders	Culture & Methods|IT Service Management|Continuous Delivery|Automated Deployment|Agile Techniques|Agile|Kata|Lean|Release Management|Stories & Case Studies|Cloud Computing
725	Four Techniques Serverless Platforms Use to Balance Performance and Cost	DevOps	Erwin van Eyk Richard Seroter	Development|Architecture & Design|Performance & Scalability|Containers|Architecture|Serverless|Cloud Computing|Kubernetes|Cloud
726	Great Managers Are Like Great Teachers: Q&A with Jessica Ingrassellino	Culture & Methods	Ben Linders Jessica Ingrassellino	Culture & Methods|Leadership|Agile Conferences|Coaching and Mentoring|Teamwork|Management|Collaboration|Agile|Agile Manager|Teaching
727	Who is in Charge of Quality in Software Development	Culture & Methods	Janet Gregory Jennifer Riggins Shane Hastie	Culture & Methods|Software Craftsmanship|TDD|Behavior Driven Development|Testing|Acceptance Testing|Agile|Quality|Agile Test|ATDD
728	Adapting Projects to Use C# 8 and Nullable Reference Types	Development	Jonathan Allen	Development|C# 8|.NET|Microsoft|C#|.NET Languages
729	Test Automation in the World of AI & ML	Culture & Methods	Anand Bagmar Shane Hastie	Culture & Methods|AI, ML & Data Engineering|Software Craftsmanship|Testing|Acceptance Testing|Automated testing|Agile|Quality|Machine Learning|Exploratory Testing|Automation|Test Design
730	Ambassador: Building a Control Plane for an Envoy-Powered API Gateway on Kubernetes	DevOps	Daniel Bryant Charles Humble	Architecture & Design|DevOps|Envoy|Containers|Service Mesh|API Gateway|Architecture|Microservices|API|Cloud Computing|Kubernetes
731	Is 2019 the Year Agile Transformation Will Finally Work?	Culture & Methods	Dave West Shane Hastie	Culture & Methods|Business Agility|Agile in the Enterprise|Agile|Adopting Agile
732	Service Catalog and Kubernetes	Architecture & Design	Ara Pulido Thomas Betts	Architecture & Design|DevOps|Azure|Amazon|Microsoft|Microservices|Cloud Architecture|Containers|IaaS|AWS|PaaS|Services|.NET|Google Cloud Platform|Architecture|Cloud Computing|Kubernetes
733	Author Q&A on the Book Product Takeoff	Culture & Methods	Navjot (Nav) Singh Kamal Manglani Shane Hastie	Culture & Methods|Product Owner|Product Development|InfoQ|Agile|Scrum|Book Review|Product Management
734	Overcoming RESTlessness	Architecture & Design	Matt McLarty Daniel Bryant	Development|Architecture & Design|REST|SOA|RPC|Enterprise Architecture|Web API|Web Services|Architecture|GraphQL|gRPC|API
735	The Complete Guide to the Java SE 12 Extended Switch Statement/Expression	Development	Mohamed Taman Daniel Bryant	Development|Java
736	Observability-Driven Development for Tackling the Great Unknown	DevOps	Jennifer Riggins Manuel Pais	DevOps|Performance|Continuous Improvement|Agile|Monitoring|On-call|Feedback|Observability|application performance management
737	Rewriting an API Gateway Service from Clojure to Golang: AppsFlyer Experience Report	Development	Asaf Yonay Daniel Bryant	Development|Architecture & Design|DevOps|Clojure|LISP|Go Language|API Gateway|Architecture|Java|Microservices|JVM Languages|API
738	Author Q&A on the Book Simplify Work	Culture & Methods	Jesse W. Newton Shane Hastie Shane Hastie	Culture & Methods|InfoQ|Work Management|Book Review
739	Virtual Panel: Kubernetes and the Challenges of Multi-Cloud	DevOps	Rags Srinivas Lew Tucker Sheng Liang Janet Kuo Marco Palladino Rags Srinivas	Development|Architecture & Design|Containers|Virtual Panel|Cloud Computing|Kubernetes|Cloud
740	Success or Burnout? Q&A on How Personal Agility Can Help	Culture & Methods	Maria Matarelli Ben Linders Peter Stevens	Culture & Methods|Coaching|Agile Conferences|Coaching and Mentoring|Personal Growth|Teamwork|Collaboration|Agile|Burnout
741	Developing Microservices with Behavior Driven Development and Interface Oriented Design	Architecture & Design	Kenneth Pugh Shane Hastie	Architecture & Design|Culture & Methods|TDD|Behavior Driven Development|Testing|Story Testing|Architecture|Microservices|Agile Test|Software Testing
742	Architecture and Design InfoQ Trends Report - January 2019	Architecture & Design	Charles Humble Jan Stenberg Thomas Betts Daniel Bryant Daniel Bryant	Development|Architecture & Design|Leadership|event sourcing|InfoQ Trends Report|Event Driven Architecture|Architecture|InfoQ|Agile|Microservices|Serverless|Cloud Computing|Evolutionary Design
743	Evidence-Based Management Guide - Updated	Culture & Methods	Ben Linders Patricia Kong Kurt Bittner	Culture & Methods|Business/IT Alignment|Enterprise Architecture|Business Value|Architecture|Scrum.org|Agile|Scrum|Innovation|Checklists and Guides
744	Q&A on the Book Build a Next-Generation Digital Workplace	Culture & Methods	Ben Linders Shailesh Kumar	Architecture & Design|Culture & Methods|Enterprise Architecture|InfoQ|Agile|Professionalism|Book Review|Software Development|Collaborative Technologies|Business/IT Alignment|Teamwork|Workplace|Collaboration|Architecture|Distributed Team|Digital Transformation|Platforms
745	Why Do We Need Architectural Diagrams?	Architecture & Design	Ionut Balosin Thomas Betts	Development|Architecture & Design|Communication|Architecture Documentation|Teamwork|Documentation|Stakeholder|Architecture|Distributed Team|Agile|Diagramming
746	Q&A on the Book Future Ethics	Culture & Methods	Cennydd Bowles Ben Linders	Culture & Methods|Ethics|Enterprise Architecture|Governance|Architecture|Product Development|InfoQ|Design|Book Review
747	Increasing the Quality of Patient Care through Stream Processing	Architecture & Design	Nuwan Bandara Himasha Guruge Nadeeshan Gimhana Roland Meertens	Development|Architecture & Design|AI, ML & Data Engineering|Event Stream Processing|Event Driven Architecture|Architecture|Healthcare|Streaming
748	Hiring and Retaining Developers - Creating Great Teams	Culture & Methods	Tamas Torok Shane Hastie	Culture & Methods|Teamwork|Agile|Hiring
749	Scaling a Distributed Stream Processor in a Containerized Environment	AI, ML & Data Engineering	Miyuru Dayarathna Sarangan Janakan Roland Meertens	Development|AI, ML & Data Engineering|Event Stream Processing|Performance & Scalability|Containers|Event Driven Architecture|Architecture|Streaming|Cloud Computing|Kubernetes
750	Q&A on the Book Refactoring - Second Edition	Culture & Methods	Martin Fowler Ben Linders	Development|Architecture & Design|Culture & Methods|Software Craftsmanship|JavaScript|InfoQ|Agile|Quality|Web Development|Design|Dynamic Languages|Book Review|Code Quality|Refactoring|Code Reviews|Architecture
751	Successful Teams: How Leaders Build Their Tech Companies	Culture & Methods	Theodora Palikarska Shane Hastie	Culture & Methods|Leadership|Teamwork|Team Collaboration|Collaboration|Distributed Team|Agile|Startup
752	Headless Selenium Browsers	Development	Jeanne Boyarsky Charles Humble	Development|Java|Automated testing|Automation|Selenium
753	Towards Successful Resilient Software Design	Culture & Methods	Uwe Friedrichsen Ben Linders	Architecture & Design|Culture & Methods|Agile Conferences|Reliability|Distributed Systems|Teamwork|Collaboration|Architecture|Agile|Design|Resilience
754	Super Charge the Module Aware Service Loader in Java 11	Development	Uday Tatiraju Ben Evans	Development|Java11|Java
755	Article Series - .NET Core - 2nd Series	Development	Chris Woodruff Jeff Martin	Development|Architecture & Design|DevOps|Distributed Cache|Clustering & Caching|Visual C++|ASP.NET Web API|ASP.NET Core|C++/CLI|Microsoft|Caching|Performance|.NET Core|.NET|C++|.NET Core Series|Infrastructure|Compilers|.NET Languages|ASP.NET
756	How to Slow Down to Go Faster Than Ever in Software Development	Culture & Methods	Lemi Orhan Ergin Ben Linders	Culture & Methods|Software Craftsmanship|Agile in the Enterprise|Agile|Quality|Adopting Agile|Source Code|Code Quality|Adoption|Software Development|Legacy Code|Debugging|Testing|Process Adoption|Lean|Hiring
757	Conquering the Challenges of Data Preparation for Predictive Maintenance	AI, ML & Data Engineering	Ian Downard Srini Penchikala	Development|Architecture & Design|AI, ML & Data Engineering|Database|Big Data|Infrastructure|Predictive Analytics
758	Space as an Enabler - Coworking as a Mindset	Culture & Methods	Ben Linders Dina Sierralta	Culture & Methods|Agile Conferences|Networking|Teamwork|GOTO Conference|Collaboration|GOTO Berlin|Infrastructure|Agile|Innovation|Remote Developer
759	Book Review: Optimizing Java	Development	Michael Redlich Victor Grazi	Development|Architecture & Design|DevOps|AI, ML & Data Engineering|GarbageCollection|Runtimes|Performance|Performance Tuning|Java|JVM|HotSpot|Virtual Machines|application performance management
760	Q&A on the Book "Lean Product Management"	Culture & Methods	Rui Miguel Ferreira	Culture & Methods|Agile|Lean|Product Management
761	How to Test ASP.NET Core Web API	Development	Chris Woodruff Jeff Martin	Development|.NET Core|Web API|.NET|Architecture|.NET Core Series|Microsoft|API|ASP.NET
762	Building a VPC with CloudFormation - Part 2	DevOps	Ken Krueger Richard Seroter	Architecture & Design|DevOps|Networking|IaaS|AWS|Amazon|Infrastructure|Cloud Computing|Cloud
763	Q&A on the Book Digital Transformation at Scale	Culture & Methods	Andrew Greenway Ben Linders	Culture & Methods|Agile In Government|Business/IT Alignment|Teamwork|Enterprise Architecture|Governance|Collaboration|Agile in the Enterprise|Architecture|Agile|Digital Transformation|Adopting Agile|Large Projects
764	Key Takeaway Points and Lessons Learned from QCon San Francisco 2018	Development	Abel Avram	Development|Architecture & Design|Culture & Methods|DevOps|AI, ML & Data Engineering|QCon San Francisco 2018|QCon
765	Understanding Blockchain Basics and Use Cases	Development	Ben Evans	Development|Architecture & Design|Blockchain|Hyperledger|Architecture|Java|Emerging Technologies
766	A Quick Tour of the .NET CLI	Development	Jeremy Miller Jeff Martin	Development|.NET Core|.NET|.NET Core Series|Microsoft
767	InfoQ’s 2018, and What We Expect to See in 2019	Development	Charles Humble	Development|Architecture & Design|Culture & Methods|DevOps|AI, ML & Data Engineering|Chaos Engineering|Ethics|Security|Quantum Computing|Architecture|Microservices|Resilience|Emerging Technologies
768	Building a VPC with CloudFormation - Part 1	DevOps	Ken Krueger Richard Seroter	Architecture & Design|DevOps|Networking|IaaS|AWS|Amazon|Infrastructure|Cloud Computing|Cloud
769	The Current State of Blockchain - Panel Discussion (Part 2)	Development	Ben Evans	Development|Architecture & Design|Culture & Methods|Blockchain|Cryptography|Security|Architecture|Cryptocurrency|Emerging Technologies
770	How to Make Cross-Functional Operations a Team Effort	Culture & Methods	Dipti Parmar Shane Hastie	Culture & Methods|Teamwork|Collaboration|Agile|Scrum|Self-organizing Team
771	The 2018 InfoQ Editors’ Recommended Reading List: Part Two	Development	Daniel Bryant Charles Humble	Development|Architecture & Design|Culture & Methods|DevOps|AI, ML & Data Engineering|Leadership|Testing|Acceptance Testing|Time Management|InfoQ|Agile|Machine Learning|Book Review|NoProjects
772	Author Q&A on the Book Project to Product by Mik Kersten	Culture & Methods	Shane Hastie Mik Kersten Shane Hastie	Culture & Methods|Business/IT Alignment|Enterprise Architecture|Business Value|Architecture|Product Development|Agile|NoProjects
773	What Machine Learning Can Learn from DevOps	DevOps	Ben Linders Thiago de Faria	Culture & Methods|DevOps|AI, ML & Data Engineering|Source Control|IT Service Management|Agile Conferences|Continuous Delivery|Automated Deployment|Agile Techniques|Agile|Machine Learning|Source Code|Teamwork|Version Control|Continuous Integration|Collaboration|Artificial Intelligence|Cloud Computing
774	.NET Core and DevOps	Development	Dave Swersky	Development|DevOps|.NET|.NET Core Series|Microsoft
775	The Current State of Blockchain - Panel Discussion (Part 1)	Development	Ben Evans	Development|Architecture & Design|Culture & Methods|Blockchain|Cryptography|Security|Architecture|Cryptocurrency|Emerging Technologies
776	JavaScript and Web Development InfoQ Trends Report	Development	Dylan Schiemann Charles Humble	Development|Architecture & Design|HTML5|HTML|JavaScript|Markup Languages|Mobile|InfoQ|Rich Internet Apps|Web Development|Dynamic Languages|TypeScript|InfoQ Trends Report|CSS|Mobile Development
777	Using Golang to Build Microservices at The Economist: A Retrospective	Development	K Jonas Daniel Bryant	Development|Architecture & Design|DevOps|Microservice Frameworks|Go Language|Event Driven Architecture|Architecture|Automated testing|Microservices|Automation
778	Analytics Zoo: Unified Analytics + AI Platform for Distributed Tensorflow, and BigDL on Apache Spark	AI, ML & Data Engineering	Jason Dai Roland Meertens	AI, ML & Data Engineering|Deep Learning|Database|Big Data|Infrastructure|Machine Learning|Apache Spark|TensorFlow
